{
  "schemaVersion": 1,
  "slug": "linear-algebra",
  "title": "线性代数",
  "aliases": [],
  "tier": "标准页",
  "status": "draft",
  "kind": "course",
  "summary": "从线性方程组出发，学习有限维实／复向量空间、线性映射、内积、谱分解与 SVD；兼顾高等代数中的证明训练与机器学习中的矩阵计算。",
  "why": "用同一套语言解释线性系统、数据表示、最小二乘和降维。本页覆盖高等代数中的线性代数核心，不把整个学校“高等代数”课程或抽象代数等同于本节点。图谱必要前置由页面动态读取 catalog；入门自检是能解二元一次方程、运算多项式并识别等价变形。证明方法作为学习技能在本页练习，不另增图谱依赖。每章先读列出的来源，再独立作答 LA-E 题，最后核对解析；以下习题与掌握阈值是本项目编写的 draft，不是来源课程的作业或评分标准。",
  "learningObjectives": [
    "把 Ax=b 的解存在性、唯一性与列空间、零空间、秩联系起来，正确描述欠定、超定与不相容系统。",
    "为多项式空间及矩阵子空间给出基与维数，并证明线性无关、直和和秩－零化度定理。",
    "区分线性映射与其坐标矩阵，推导换基关系 P⁻¹AP，解释相似不变量。",
    "用内积解释正交投影，推导最小二乘正规方程，识别满列秩条件并完成 Gram–Schmidt。",
    "判断何时可对角化、何时可正交／酉对角化，使用反例说明二者条件不同。",
    "用 SVD 说明矩阵秩、伪逆、低秩近似与误差，并将对称正定性连接到二次型。"
  ],
  "coreTopics": [
    "线性系统与消元",
    "向量空间、基与维数",
    "线性映射与秩－零化度",
    "坐标变换与相似",
    "行列式",
    "内积、正交与最小二乘",
    "特征值与谱定理",
    "二次型与正定性",
    "奇异值分解与伪逆"
  ],
  "syllabus": [
    {
      "title": "线性方程组：从计算到解空间 [LA1, LA3]",
      "topics": [
        "Ax=b 有解当且仅当 b∈col(A)；有解时通解为一个特解加 ker(A)。",
        "消元的初等行操作保持解集；主元列要从原矩阵选取。用秩比较未知数与独立约束。",
        "阅读 MIT 18.06 的消元／零空间部分或 Treil 第2章；完成 LA-E01、E02。"
      ]
    },
    {
      "title": "向量空间、子空间、基与维数 [LA1–LA3]",
      "topics": [
        "以 Rⁿ、Cⁿ 和次数≤n的多项式为例；子空间包含零且对线性组合封闭。",
        "基同时保证存在且唯一的坐标表示；有限维空间任意两组基等长。dim(U+W)=dim U+dim W−dim(U∩W)。",
        "阅读 Axler 第1–2章或 Treil 第1–2章；完成 LA-E03。"
      ]
    },
    {
      "title": "线性映射、矩阵与换基 [LA1–LA3]",
      "topics": [
        "线性映射满足 T(au+bv)=aT(u)+bT(v)；矩阵列是基向量的像的坐标。",
        "对 T:V→W，dim V=dim ker T+dim im T；同一算子在新基下的矩阵为 P⁻¹AP。",
        "阅读 Axler 第3章或 Treil 第2章§7–8；完成 LA-E04、E05。"
      ]
    },
    {
      "title": "行列式与可逆性 [LA1–LA3]",
      "topics": [
        "行列式对列多线性、交替，且 det I=1；它刻画有向体积缩放。det A≠0 等价于方阵可逆。",
        "利用三角矩阵、行操作和 det(AB)=det A·det B 简化计算；不把行列式当作大型数值求解算法。",
        "三体系教学顺序不同：MIT／Treil较早讲，Axler第9章较晚讲。完成 LA-E06。"
      ]
    },
    {
      "title": "内积、正交、投影与最小二乘 [LA1–LA3]",
      "topics": [
        "实内积为 xᵀy，复数情形用共轭转置 x*y；正交分解给出到子空间的最近点。",
        "满列秩时投影矩阵为 A(AᵀA)⁻¹Aᵀ，最小二乘满足 Aᵀ(Ax−b)=0；缺秩时解不唯一。",
        "Gram–Schmidt 构造正交基并得到 QR；数值实现优先用库的 QR／lstsq，正规方程用于推导。阅读 Axler第6章、Treil第5章；完成 LA-E07、E08。"
      ]
    },
    {
      "title": "特征值、对角化与谱定理 [LA1–LA3]",
      "topics": [
        "Av=λv 要求 v≠0；相似矩阵具有相同特征多项式。可对角化等价于存在特征向量基。",
        "重根本身既不保证也不排除可对角化；实对称矩阵可正交对角化，复自伴矩阵可酉对角化。",
        "阅读 Axler第5章及第7章谱定理、Treil第4／6章；完成 LA-E09。"
      ]
    },
    {
      "title": "二次型与正定性 [LA1–LA3]",
      "topics": [
        "对实对称 A，xᵀAx 在正交换元后成为特征值加权的平方和。所有特征值>0等价于正定。",
        "区分相似 P⁻¹AP 与合同 PᵀAP；正交换基时二者形式一致，但一般不能混用。阅读 Axler第7章正算子／第9章二次型、Treil第7章；完成 LA-E10。"
      ]
    },
    {
      "title": "SVD、伪逆与机器学习连接 [LA1–LA3]",
      "topics": [
        "任意实 m×n 矩阵 A=UΣVᵀ；非零奇异值是 AᵀA 的正特征值的平方根，数目等于秩。",
        "伪逆将非零奇异值取倒数并保留零；截断 SVD 给出低秩近似。PCA需先明确中心化，不能把一般特征分解与SVD混淆。",
        "阅读 MIT SVD 单元、Axler§7E–7F或Treil第6章§3；完成 LA-E11、E12。"
      ]
    },
    {
      "title": "选学扩展：不计入基础完成门槛",
      "topics": [
        "广义特征向量／Jordan结构见 Axler第8章、Treil第9章；双线性形式与张量见Axler第9章、Treil第8章。",
        "这些内容不因两本教材收录而成为三体系的共同入门核心；无限维分析、一般域上的代数和数值算法深入仍由后续节点承担。"
      ]
    }
  ],
  "resources": [
    {
      "type": "公开课",
      "title": "[LA1] MIT 18.06 Linear Algebra，Spring 2010：计算与几何路线",
      "author": "Gilbert Strang",
      "institution": "MIT",
      "url": "https://ocw.mit.edu/courses/18-06-linear-algebra-spring-2010/pages/syllabus/",
      "verification": "已核验"
    },
    {
      "type": "主教材",
      "title": "[LA2] Linear Algebra Done Right，第4版，2026-08-16 PDF：证明路线",
      "author": "Sheldon Axler",
      "institution": "",
      "url": "https://linear.axler.net/LADR4e.pdf",
      "verification": "已核验"
    },
    {
      "type": "主教材",
      "title": "[LA3] Linear Algebra Done Wrong，2026-08-31 PDF：计算与证明桥接",
      "author": "Sergei Treil",
      "institution": "Brown University",
      "url": "https://www.math.brown.edu/~treil/papers/LADW/LADW_2026_08-31.pdf",
      "verification": "已核验"
    },
    {
      "type": "参考资料",
      "title": "[LA4] MIT 18.06 官方练习与解答入口",
      "author": "Gilbert Strang",
      "institution": "MIT",
      "url": "https://ocw.mit.edu/courses/18-06-linear-algebra-spring-2010/pages/assignments/",
      "verification": "已核验"
    }
  ],
  "exercises": [
    {
      "type": "基础题",
      "description": "LA-E01｜题目：A=[[1,2,1],[2,4,2],[1,1,0]]，b=(2,4,1)ᵀ。求秩、通解与零空间的基。\n解析：第二行是第一行的2倍；第一行减第三行给 x₂+x₃=1，第三行给 x₁+x₂=1。令 x₃=t，则 x=(t,1−t,t)ᵀ；rank A=2，ker A=span{(1,−1,1)ᵀ}。代回每一行都成立。\n掌握检查：能解释为什么解集是仿射空间，而 b≠0 时通常不是子空间。"
    },
    {
      "type": "综合题",
      "description": "LA-E02｜题目：保持 E01 的 A，改为 b=(2,5,1)ᵀ。是否有解？给出不依赖完整消元的证据。\n解析：任何 Ax 的第二分量必等于第一分量的2倍，b却不满足；或取 y=(−2,1,0)ᵀ，有 Aᵀy=0 而 yᵀb=1。若 Ax=b，则 yᵀb=yᵀAx=0，矛盾。\n掌握检查：能将不相容证据解释为 b 不在列空间，而非笼统说“未知数太少”。"
    },
    {
      "type": "证明题",
      "description": "LA-E03｜题目：在 P₂(R) 中，U={p:p(1)=0}。求一组基，并证明任意两个子空间 U,W 满足维数公式。\n解析：U 的每个元素唯一写作 a(x−1)+b(x²−1)，所以这两项构成基，dim U=2。维数公式：取 U∩W 的基，分别扩充为 U 与 W 的基；合并后只保留一份交集基。该合并集张成 U+W；线性关系中的 U 部分等于负的 W 部分，故落在交集，再用各扩充基的独立性得所有系数为0。计数即得公式。\n掌握检查：证明需同时说明张成与独立；不能只列出正确维数。"
    },
    {
      "type": "证明题",
      "description": "LA-E04｜题目：对有限维 T:V→W 证明秩－零化度定理，并用于 D:P₃(R)→P₂(R)，D(p)=p′。\n解析：取 ker T 的基 u₁,…,uₖ，扩充成 V 的基 u₁,…,uₖ,v₁,…,vᵣ。T(vⱼ) 张成 im T；若它们线性组合为0，则对应 v 的组合在 ker T，由扩充基独立性推出系数均0。因此 dim V=k+r。D的核为常数，像为P₂（每个多项式可取原函数），所以4=1+3。\n掌握检查：能明确有限维假设，不能把“矩阵方阵”当作证明前提。"
    },
    {
      "type": "基础题",
      "description": "LA-E05｜题目：标准基下 A=diag(1,2)，新基 B=((1,1)ᵀ,(1,−1)ᵀ)。求 [T]B。\n解析：P=[[1,1],[1,−1]] 把新坐标送到旧坐标，P⁻¹=P/2。故 [T]B=P⁻¹AP=[[3/2,−1/2],[−1/2,3/2]]。也可分别将 T(1,1) 和 T(1,−1) 用 B 表示得到两列。\n掌握检查：用非对称例子复查换基方向；此例 P⁻¹=P/2，单靠背结果不能证明掌握。"
    },
    {
      "type": "基础题",
      "description": "LA-E06｜题目：B=[[1,2,0],[0,3,4],[0,0,5]]。求 det B、det B⁻¹，并说明相似矩阵行列式相同。\n解析：三角矩阵行列式为对角线积，det B=15，故可逆且 det B⁻¹=1/15。由乘法性 det(P⁻¹BP)=det(P)⁻¹ det(B)det(P)=15。\n掌握检查：区分相似不变量与合同变换：后者行列式还乘 det(P)²。"
    },
    {
      "type": "综合题",
      "description": "LA-E07｜题目：给定 A=[[1,0],[1,1],[1,2]]，b=(1,2,2)ᵀ，拟合截距与斜率。\n解析：AᵀA=[[3,3],[3,5]]，Aᵀb=(5,6)ᵀ；解得 x=(7/6,1/2)ᵀ。拟合值为(7/6,5/3,13/6)ᵀ，残差 b−Ax=(−1/6,1/3,−1/6)ᵀ，其与两列内积均为0；残差平方和为1/6。A满列秩，因此解唯一。\n掌握检查：能从残差正交性推导正规方程，而不是无条件使用逆矩阵公式。"
    },
    {
      "type": "基础题",
      "description": "LA-E08｜题目：对 a₁=(1,1,0)ᵀ，a₂=(1,0,1)ᵀ 做 Gram–Schmidt，写出薄QR。\n解析：q₁=(1,1,0)ᵀ/√2；去掉 a₂ 在 q₁ 上的投影得到(1/2,−1/2,1)ᵀ，归一化得 q₂=(1,−1,2)ᵀ/√6。Q=[q₁,q₂]，R=[[√2,1/√2],[0,√(3/2)]]。检查 QᵀQ=I 及 QR=[a₁,a₂]。\n掌握检查：若第二列是第一列倍数，应说明第二步残差为0，不能除以0。"
    },
    {
      "type": "证明题",
      "description": "LA-E09｜题目：比较 J=[[1,1],[0,1]] 与 I₂：都只有特征值1，为何一个不可对角化？证明不同特征值对应的特征向量独立（两个向量情形）。\n解析：ker(J−I)由(1,0)ᵀ张成，只有1维，不能形成2维特征向量基；I₂的特征空间为R²。若 av+bw=0，Tv=λv，Tw=μw，λ≠μ，将 T 作用于关系后减去 μ 倍原关系，得 a(λ−μ)v=0，故a=0，再得b=0。\n掌握检查：不能以重根作为不可对角化的充分条件。"
    },
    {
      "type": "综合题",
      "description": "LA-E10｜题目：A=[[2,1],[1,2]]。求正交谱分解并判断正定性。\n解析：u₁=(1,1)ᵀ/√2、u₂=(1,−1)ᵀ/√2分别对应3、1。令 Q=[u₁,u₂]，则 A=Q diag(3,1)Qᵀ。换元 z=Qᵀx 后 xᵀAx=3z₁²+z₂²>0（x≠0），因此正定。\n掌握检查：能指出“实对称”保证正交谱分解，不能对任意矩阵套用。"
    },
    {
      "type": "综合题",
      "description": "LA-E11｜题目：A=[[3,0],[0,1],[0,0]]。写出薄SVD、伪逆和最佳秩1近似的Frobenius误差。\n解析：薄SVD为 U=[[1,0],[0,1],[0,0]]，Σ=diag(3,1)，V=I₂；伪逆 A⁺=[[1/3,0,0],[0,1,0]]。截断为 A₁=[[3,0],[0,0],[0,0]]，误差‖A−A₁‖F=1（平方误差1）；这是丢弃奇异值的平方和开根号。\n掌握检查：区分薄SVD与完整正交矩阵形式，并能说明伪逆不是矩形矩阵的双边逆。"
    },
    {
      "type": "编程题",
      "description": "LA-E12｜题目：用 NumPy 或 R 重做 E07、E11，报告正交性、拟合残差、SVD重构和秩1误差；无需编程前置也可手算。\n解析：NumPy路线：lstsq(A,b,rcond=None)求最小二乘；svd(A,full_matrices=False)求U,s,Vh；(U*s)@Vh重构，U[:,:1]*s[:1]再乘Vh[:1,:]截断。E07系数为(7/6,1/2)、平方残差1/6；E11奇异值为3、1、重构误差在舍入精度内、秩1误差1。实现返回Vh=Vᵀ；不逐项比较SVD向量符号，因为分解不唯一。\n掌握检查：交付输入、库版本、容差、重构及正交残差；随机数据的数值通过不能替代定理证明。"
    }
  ],
  "projects": [
    {
      "title": "消元、投影与SVD学习档案",
      "description": "顺序完成 LA-E01–E12；每题保留第一次独立答案、核对后的修订和一个错误原因。对 E02、E09 各改一个条件，说明结论何时改变。",
      "deliverable": "12题解答、2个条件变体、换基与谱分解条件表；编程题可用手算记录替代。"
    },
    {
      "title": "低秩表示小实验（选做）",
      "description": "自建一个中心化的5×3实矩阵，比较秩1／2重构；先推导误差应等于被舍弃奇异值平方和，再用库核对。此项目不评价机器学习模型效果。",
      "deliverable": "矩阵、中心化约定、奇异值、两种误差、可重复运行代码或完整手算。"
    }
  ],
  "completion": {
    "basic": "项目建议门槛：独立完成E01–E11中的至少8题，且E02的不相容判断、E05换基方向、E09对角化条件必须正确；每题有过程，计算题代回，证明题注明假设。若未达标，按错误章节重学；这不是任何学校官方成绩。",
    "proficient": "独立完成E01–E11全部题并解释解析；能证明秩－零化度与残差正交，能对缺秩系统和重根矩阵构造反例。至少做2个未见过的来源练习：一题证明、一题投影或SVD，先写解答再查官方解答；保留修订记录。",
    "researchReady": "仅表示下一阶段准备：完成选做低秩项目或等量手算，能解释SVD截断误差、正定性与坐标变化的条件及数值舍入局限；可开始图谱后续的最优化、数理统计或数值线性代数。本页不证明已具备独立科研或无限维分析能力。"
  },
  "sources": [
    {
      "sourceType": "大学课程",
      "title": "[LA1] MIT 18.06，Spring 2010：syllabus",
      "institution": "MIT",
      "url": "https://ocw.mit.edu/courses/18-06-linear-algebra-spring-2010/pages/syllabus/",
      "verification": "已核验",
      "checkedAt": "2026-10-11"
    },
    {
      "sourceType": "大学课程",
      "title": "[LA1-C] MIT 18.06：单元主题定位",
      "institution": "MIT",
      "url": "https://ocw.mit.edu/courses/18-06-linear-algebra-spring-2010/pages/calendar/",
      "verification": "已核验",
      "checkedAt": "2026-10-11"
    },
    {
      "sourceType": "教材",
      "title": "[LA2] Axler，Linear Algebra Done Right，第4版（2026-08-16 PDF），第1–7及9章",
      "institution": "",
      "url": "https://linear.axler.net/LADR4e.pdf",
      "verification": "已核验",
      "checkedAt": "2026-10-11"
    },
    {
      "sourceType": "教材",
      "title": "[LA3] Treil，Linear Algebra Done Wrong（2026-08-31 PDF），第1–7章",
      "institution": "Brown University",
      "url": "https://www.math.brown.edu/~treil/papers/LADW/LADW_2026_08-31.pdf",
      "verification": "已核验",
      "checkedAt": "2026-10-11"
    },
    {
      "sourceType": "大学课程",
      "title": "[LA4] MIT 18.06：官方练习与解答入口",
      "institution": "MIT",
      "url": "https://ocw.mit.edu/courses/18-06-linear-algebra-spring-2010/pages/assignments/",
      "verification": "已核验",
      "checkedAt": "2026-10-11"
    }
  ]
}
